datetime,city,state,country,shape,duration (seconds),duration (hours/min),comments,date posted,latitude,longitude 
4/1/2009 20:30,gainesville,fl,us,changing,45,45 seconds,One fiery ball that grew into a crescent shape&#44 then an apparent battle between 2 jets and a small craft.,12/12/2009,29.6513889,-82.325
4/1/2009 21:04,royal palm beach,fl,us,formation,15,10-15 seconds,Triangle shaped flying object over Royal Palm Beach&#44 Fl,4/14/2009,26.7080556,-80.2308333
4/1/2009 23:40,kosciusko,ms,us,triangle,45,45 seconds,3 triangular shaped objects &quot;gliding&quot; over the house.  All 3 had this orange-white transparent glow.,8/5/2009,33.0575,-89.5875
4/2/2009 11:30,woodside,ny,us,oval,60,1 minute,I was standing on the platform of the 7 subway train in Woodside&#44 NY (61st / Woodside stop).  I&#39m about 15 mins by subway from NYC.  Th,4/14/2009,40.7452778,-73.9058333
4/2/2009 21:00,jackson,oh,us,other,60,1 minute,Horse shoe shaped UFO&#44 Jackson&#44 Ohio.,4/14/2009,39.0519444,-82.6366667
4/2/2009 21:30,anahuac,tx,us,cylinder,2700,45 minutes,On 4-2-09 one picture was taken at 9:30 pm&#44 and another at 10:10 pm with our Moultrie Game Spy D40 Digital  game camera&#44 and got this i,5/12/2009,29.7727778,-94.6825
4/2/2009 22:40,stockbridge,ma,us,light,900,15 minutes,Stockbridge UFO-2009,4/14/2009,42.2875,-73.3208333
4/3/2009 1:00,durham,nc,us,disk,120,minutes,Have video for sale of this UFO that seems to be a Mothership&#33&#33&#33There are six of them in orbit&#44 Above  us.???  500 Lights On Object0: Y,4/14/2009,35.9938889,-78.8988889
4/3/2009 13:45,norfolk,ma,us,light,30,30 seconds,lights in my home that seemed intelligent and not a ghost,5/12/2009,42.1194444,-71.3255556
4/3/2009 14:30,catonsville,md,us,sphere,20,20 seconds,Round&#44 silvery object floating over Catonsville MD.,4/14/2009,39.2719444,-76.7322222
4/3/2009 18:00,leitchfield,ky,us,circle,45,45 seconds,unknown lights in a field,6/9/2009,37.48,-86.2938889
4/3/2009 20:30,inverness,fl,us,fireball,180,3 minutes,Orange fireball (?) over Inverness&#44 FL night sky,4/14/2009,28.8355556,-82.3305556
4/3/2009 20:30,sumrall,ms,us,sphere,4200,1 hour&#44 10 min,Witnesses sighting of large ufo with 4 smaller crafts moving near by.,4/14/2009,31.4172222,-89.5422222
4/3/2009 21:35,saint augustine beach (nearest),fl,us,sphere,60,one minute or less,Anomolous Aircraft Sighting in Saint Augustine Florida,4/14/2009,29.8502778,-81.2655556
4/4/2009 12:20,marietta,ga,us,sphere,300,five minuets,Saturday April 04/2009  around 12:30 pm - Atlanta Georgia &#8211; weather clear&#44 sunny&#44 and blue sky&#39s. While working in the yard (north,4/14/2009,33.9525,-84.55
4/4/2009 12:32,brandenburg,ky,us,unknown,480,8 minutes,very loud&#44 slow&#44 low flying object,5/12/2009,37.9988889,-86.1694444
4/4/2009 15:20,bristol,ct,us,cigar,180,3 minutes,i do not believe it was something from this planet...very strange.,4/14/2009,41.6716667,-72.9497222
4/4/2009 18:06,east berlin,pa,us,oval,120,2 min,black spot in photo from spy cam,4/14/2009,39.9375,-76.9788889
4/4/2009 20:00,st. augustine,fl,us,light,300,5 minutes,Orange light over the ocean,4/14/2009,29.8944444,-81.3147222
4/4/2009 21:00,flagstaff,az,us,light,600,ten minutes,We saw an orange light moving around in the sky and going out twice&#44 for about ten minutes.,4/14/2009,35.1980556,-111.6505556
4/4/2009 21:20,lawrenceville,ga,us,sphere,10,10 seconds,Orang colored sphere skipping very fast across the night sky,4/14/2009,33.9561111,-83.9880556
4/4/2009 22:05,cincinnati,oh,us,light,300,5 min,3 orange lights of fire in a straight line moving slow.,4/14/2009,39.1619444,-84.4569444
4/4/2009 22:30,oceanside,ca,us,light,60.1,1 min. 10 secs.,Single bright light in southwestern sky at 75 degrees with single side to side movement and disappearance.,6/9/2009,33.1958333,-117.3786111
4/4/2009 23:00,horsham,pa,us,triangle,30,30 seconds,Triangle,4/14/2009,40.1783333,-75.1288889
4/4/2009 23:45,santa rosa,ca,us,light,120,1 1/2 minute,Five or six hovering lights formed into a triangle in the sky in Santa Rosa&#44 California.,4/14/2009,38.4405556,-122.7133333
4/4/2009 23:59,webster,mn,us,light,10,10 seconds,Last night&#44 about 12 midnight on April 4th 2009 I was sitting in our sunroom (large windows) at our computer looking at colleges online,4/14/2009,44.5297222,-93.3525
4/5/2009 2:45,clarksville,md,us,cigar,300,5 minutes,Large Mettalic Object making no sounds with red and green lights hovering by power lines moves away fast&#33,4/14/2009,39.2063889,-76.9433333
4/5/2009 4:30,paw paw (near),wv,us,oval,25,20-25 seconds,Saw a bright&#44 very short cylinder or oval move across the night sky&#44 brighten intensely&#44 then disappear&#44 all within about 25 seconds.,4/14/2009,39.5319444,-78.4586111
4/5/2009 16:20,cedar park,tx,us,disk,20,20 seconds,On a clear blue afternoon sky&#44 there appeared a slow moving disk-like shiny object that gradually vanished after about 20 seconds,4/14/2009,30.505,-97.82
4/5/2009 17:00,wilmington,ca,us,sphere,600,10 minutes,3 spheres above the Los Angeles Harbor,4/14/2009,33.78,-118.2616667
4/5/2009 20:00,monmouth beach,nj,us,light,3600,1 hour,Many strange red lights over Monmouth Beach,5/12/2009,40.3302778,-73.9819444
4/5/2009 21:00,des moines,wa,us,oval,300,5minutes,I saw an ovel craft very high in the sky moving very quickly and changing directions from east to west it was glowing blue in color.,5/12/2009,47.4019444,-122.3230556
4/5/2009 22:08,champaign,il,us,triangle,7,7 seconds,fast moving triangle with neon green light at each end&#44 making no sound as it moved,5/12/2009,40.1163889,-88.2433333
4/6/2009 1:02,pensacola,fl,us,triangle,30,30 sec,I saw 7 lights in the shape of the letter &quot;V&quot;&#44 They were all independant but flew together.,4/14/2009,30.4211111,-87.2169444
4/6/2009 9:15,nashville,tn,us,light,120,2 min,I went to get a pack of cigaretts&#44 only a 2 min walk... but I drove because I felt lazy.  got my cigarettes... walking back to my apart,4/14/2009,36.1658333,-86.7844444
4/6/2009 13:15,bridgeton,mo,us,disk,300,5 min,Silver/Blue Disk Rotating end over end East to West at least 20&#44000&#39,4/14/2009,38.7669444,-90.4113889
4/6/2009 18:10,indianapolis,in,us,triangle,7,7 seconds,wings up trianglur shaped craft moving faster than any jet and No flapping like a birds wings,4/14/2009,39.7683333,-86.1580556
4/6/2009 21:00,clive,ia,us,sphere,3,3 seconds,veering shooting star?,4/14/2009,41.6030556,-93.7238889
4/6/2009 21:15,nashville,tn,us,oval,120,2min,NUFORC Home Page Web Report Indexes : by Event Date | by Location | by Shape | by Posting Date National UFO Reporting Center Sighting R,6/9/2009,36.1658333,-86.7844444
4/6/2009 22:30,arlington,wa,us,other,600,about 10min,Star like motionless object pulsating blue and red&#44 lasted only five minutes and was gone,4/14/2009,48.1988889,-122.1238889
4/6/2009 22:30,carson,ca,us,other,30,30 seconds,Invisible Craft flying above it was VERY LOUD&#33,4/14/2009,33.8313889,-118.2811111
4/7/2009 0:00,austin,tx,us,circle,1200,about 20 min,Bright Star like object,4/14/2009,30.2669444,-97.7427778
4/7/2009 18:50,austin,tx,us,unknown,20,15 -20 seconds,A very bright object over Austin TX that follows plan then passes it like nothing seem to be investigating the plan.,4/14/2009,30.2669444,-97.7427778
4/7/2009 21:01,daytona beach,fl,us,oval,2,2 seconds,Large glowing blue object blasts into space at hyper sonic speeds&#44 appeared no more than 300 feet from surface,4/14/2009,29.2105556,-81.0230556
4/7/2009 21:42,vero beach,fl,us,light,5,5 sec,Bright Green Light streaming from east to west&#44 slowed then turned white.,4/14/2009,27.6383333,-80.3975
4/7/2009 21:45,tampa,fl,us,sphere,1.5,1-1.5 seconds,A bright green sphere about the size of the moon shot across the sky in Tampa FL.,4/14/2009,27.9472222,-82.4586111
4/7/2009 22:10,lorida,fl,us,sphere,10,10 seconds,Single white ball streaking downward for 10 seconds.  Sudden disappearance.,4/14/2009,27.4430556,-81.2538889
4/7/2009 22:30,abilene,tx,us,triangle,1800,30 minutes,Pictures were taken on cell phone.,4/14/2009,32.4486111,-99.7327778
4/7/2009 22:30,las vegas,nv,us,formation,30,20 to 30 seconds,Green lights across las vegas&#44 fast&#44 tightly formationed and switching places&#44 low flying and gone within 30 seconds.,4/14/2009,36.175,-115.1363889
4/7/2009 23:20,jacksonville beach,fl,us,light,60,60 seconds,Unidentified lights over Jacksonville Beach,4/14/2009,30.2944444,-81.3933333
4/8/2009 5:00,fort sumner,nm,us,light,2,a few seconds,Odd light,4/14/2009,34.4716667,-104.245
4/8/2009 14:50,oklahoma city,ok,us,,1200,20 minutes,Group of round silver objects traveling across sky and reversing direction .,4/14/2009,35.4675,-97.5161111
4/8/2009 20:31,fayetteville,ar,us,unknown,600,8-10 mins.,a object fell&#44 then two hours pased. 500 Lights On Object0: Yes,5/12/2009,36.0625,-94.1572222
4/8/2009 21:10,santa barbara,ca,us,unknown,300,5 minutes,It seemed like it was in orbit but was way too big to be the space station.  It was moving towards the WNW over Santa Barbara&#44 CA at a,4/14/2009,34.4208333,-119.6972222
4/8/2009 21:55,toledo,oh,us,circle,300,5 mins,Round craft with big bright lights near Toledo&#44  OH.,4/14/2009,41.6638889,-83.5552778
4/8/2009 22:00,bonita springs,fl,us,disk,3,3 seconds,Very bright solid gold disc sighted in Bonita Springs&#44 FL,4/14/2009,26.3394444,-81.7788889
4/8/2009 22:00,holden beach,nc,us,light,2400,40 minutes,Holden Beach NC - Big Orange Light  Over The Ocean In The Night Sky,4/13/2010,33.9133333,-78.3041667
4/9/2009 2:00,mount vernon,wa,us,triangle,4,4 seconds,My two friends and I saw a triangular formation of lights in the sky and when we went to video tape them&#44 they simply disappeared.,4/14/2009,48.4213889,-122.3327778
4/9/2009 8:12,charlotte,nc,us,cylinder,360,about 6 minutes,Bright White/Chrome Cylinder against Carolina Blue clear sky.,4/14/2009,35.2269444,-80.8433333
4/9/2009 8:12,charlotte,nc,us,cylinder,420,5-7 minutes,Rotating Cylindrical object passes overhead.,4/14/2009,35.2269444,-80.8433333
4/9/2009 20:13,lake worth,fl,us,oval,120,2 minutes,ufo between clouds,4/14/2009,26.6155556,-80.0572222
4/9/2009 22:45,calcutta,oh,us,circle,600,10 minutes,3 lighted circular craft over calcutta&#44ohio.,5/12/2009,40.6733333,-80.5766667
4/10/2009 2:23,new york city (bronx),ny,us,,60,1 minute,image of a sphinx in a cloud of light  over manhatten at 2:am along with two fighter jets,12/12/2009,40.7141667,-74.0063889
4/10/2009 5:50,orlando,fl,us,light,60,60 seconds,Early morning aerial maneuvers by 2 objects&#44 one blue and one white,4/14/2009,28.5380556,-81.3794444
4/10/2009 8:30,everett,ma,us,circle,20,20 seconds,Everett Mass 3 witnesses,8/5/2009,42.4083333,-71.0541667
4/10/2009 11:34,orlando,fl,us,triangle,10,0:10 seconds,Black Triangle&#44 Three lights in the shape of a triangle.,4/14/2009,28.5380556,-81.3794444
4/10/2009 13:00,lake charles,la,us,light,10,about 10 seconds,single white light high above Louisiana swamps,12/12/2009,30.2263889,-93.2172222
4/10/2009 21:30,ramsey,mn,us,teardrop,120,2 minutes,Red -Orange teardrop shaped &#44  silent  fast moving obect,4/14/2009,45.2461111,-93.4519444
4/11/2009 11:20,bismarck,nd,us,disk,3,3 seconds,silver disc shaped object flying extremely fast at a low altitude,5/12/2009,46.8083333,-100.7833333
4/12/2009 9:30,los angeles,ca,us,teardrop,420,7 minutes,White shape changing orb in Los Angeles sky,6/9/2009,34.0522222,-118.2427778
4/12/2009 10:15,arcadia,ca,us,cylinder,600,5-10min,An tight formation.,5/12/2009,34.1397222,-118.0344444
4/13/2009 7:30,grand rapids,mi,us,sphere,2400,40 minutes,A bright spherical object with windows around the middle of the craft.  It just hovered silently for 30 minutes.,8/5/2009,42.9633333,-85.6680556
4/13/2009 14:00,san antonio,tx,us,other,600,10 minutes,Black&#44 gumdrop/bell shaped object sighted over downtown San Antonio&#44 TX,5/12/2010,29.4238889,-98.4933333
4/13/2009 22:00,franklin,nj,us,light,259200,3 days+,bright then dim flashing red white green lights - not moving and low in the sky.  ((NUFORC Note:  Sighting of star??  PD)),5/12/2009,41.1219444,-74.5808333
4/13/2009 22:50,shepherd,tx,us,triangle,60,1.00 minute,triangle object with bright lights,5/12/2009,30.4977778,-94.9963889
4/13/2009 23:15,aubrey,tx,us,light,1800,30 + min,bright blinking light on light moving about with fast pace in northwestern sky over Denton County Texas,5/12/2010,33.3041667,-96.9858333
4/14/2009 21:00,kansas city,mo,us,oval,10,10 sec.,Blue football of light seen over Kansas City near Claycomo,5/12/2009,39.0997222,-94.5783333
4/15/2009 1:00,tulsa,ok,us,triangle,15,10-15 seconds,UFO Sighting in Tulsa&#44 OK,8/5/2009,36.1538889,-95.9925
4/15/2009 12:00,montpelier,id,us,cross,180,about 3 minutes,4 lobed craft hovering over Montpelier&#44 ID in broad daylight.,7/4/2011,42.3222222,-111.2969444
4/15/2009 15:51,tampa,fl,us,circle,2,2sec,I was taking a series of pics of airliner  and in only two pics  did an unknown object appear. At first it was small white dot and in n,5/12/2009,27.9472222,-82.4586111
4/15/2009 16:00,jefferson,ga,us,egg,60,1 minute,I WAS OUTSIDE WATCHING A THUNDERSTORM. IT WAS SCATTERED DARK CLOUDS SO THE SUN WAS STILL VISIBLE. I TURN TO MY RIGHT AFTER A LIGHTNING,7/28/2010,34.1169444,-83.5725
4/15/2009 20:00,leesport,pa,us,disk,5,5 seconds,Craft 100 feet above water red and white lights flew towards us stopped in midflight zigzagged and shot into sky,12/12/2011,40.4469444,-75.9666667
4/15/2009 21:09,encinitas,ca,us,sphere,7,5 - 7 seconds,solid reddish orb&#44 no lights 100 feet up and northbound at about 30mph.,5/12/2009,33.0369444,-117.2911111
4/15/2009 23:00,newark,ca,us,triangle,30,30 seconds,Orange Triangle shaped craft,7/4/2012,37.5297222,-122.0391667
4/15/2009 23:00,richmond,va,us,light,180,3 minutes,((HOAX??))  Strange light make j shape in rva,2/14/2010,37.5536111,-77.4605556
4/16/2009 2:00,hermiston,or,us,triangle,8,8 seconds,V Light Formation,5/12/2009,45.8405556,-119.2883333
4/16/2009 11:00,fenton,mi,us,cross,7200,2 hours,that your fake&#33,5/12/2009,42.7977778,-83.705
4/16/2009 11:26,clarks summit,pa,us,unknown,120,2 minutes,THIS WAS WITNESSED IN THE DAY -- A CLEAR BLUE SKYED DAY &#44 AND IT WAS FAST &#33&#33,5/12/2009,41.4886111,-75.7088889
4/16/2009 15:00,summersville,wv,us,cylinder,30,30 sec,Large  white cylinder object heading northwest direction,5/12/2009,38.2811111,-80.8527778
4/16/2009 17:00,st. augustine,fl,us,sphere,90,1.5 minutes,Large&#44 metal&#44 cylinder object over Saint Augustine Beach hovers and then disappears.,5/12/2009,29.8944444,-81.3147222
4/16/2009 17:25,greenwich,ct,us,cylinder,60,1minute,Cylindrical object in South Wester Connecticut,5/12/2009,41.0263889,-73.6288889
4/16/2009 21:45,las vegas,nv,us,cigar,180,3 minutes,This stuff is real&#33 I&#44 Mr.Non-believer&#44 saw this. With my own eyes.,5/12/2009,36.175,-115.1363889
4/16/2009 21:45,oak hill,oh,us,unknown,25,25 seconds,3 round lights in line horizontally hovering in place near a radio tower&#44 disappear one by one.,5/12/2009,38.8938889,-82.5736111
4/16/2009 21:45,toledo,oh,us,other,10,10 seconds,UFO spotted over Toledo&#44 OH&#44 USA. Arc shaped and semi-tranparent.,5/12/2009,41.6638889,-83.5552778
4/16/2009 21:55,chillicothe,oh,us,changing,10,10 seconds,5 orange glowing lights in the south western sky,5/12/2009,39.3330556,-82.9825
4/16/2009 22:00,fremont,in,us,light,3600,1 hour plus,A star like object that hovered and appeared to change color.,5/12/2009,41.7308333,-84.9327778
4/16/2009 23:10,newark,oh,us,light,3600,1 hour,big bright ball of light and a smaller redish light,5/12/2009,40.0580556,-82.4013889
4/16/2009 23:30,hernando,ms,us,rectangle,30,approx. 30 seconds,Stealthy rectangular object seen over Hernando&#44 MS,5/12/2009,34.8238889,-89.9936111
4/17/2009 0:45,bossier city,la,us,triangle,600,10 min,triangular craft seen over city,5/12/2009,32.5158333,-93.7319444
4/17/2009 0:47,santa barbara,ca,us,triangle,5,5 seconds,Silent Soaring Triangle with greyish tips heading West very Ominous.,5/12/2009,34.4208333,-119.6972222
4/17/2009 1:00,isla vista,ca,us,triangle,6,6 seconds,Triangular UFO with 7 dim lights in a V shape flies over Isla Vista in Santa Barbara&#44 CA.,5/12/2009,34.4133333,-119.86
4/17/2009 2:45,orono (university of maine),me,us,triangle,420,7 minutes,On April 17th&#44 on the UMaine campus&#44 we saw a triangle shaped craft with three orange lights and one white light.,5/12/2009,44.8830556,-68.6725
4/17/2009 6:22,maryville,tn,us,light,10,10 seconds,Bright white dot hovers in sky&#44 quickly drops down&#44 then shoots up and disappears leaving a copper streak,5/12/2009,35.7563889,-83.9705556
4/17/2009 6:30,york,pa,us,light,10,half an hour,Bright shiny object that suddenly disappeared.,5/12/2009,39.9625,-76.7280556
4/17/2009 11:00,wilhoit,az,us,light,45,45 seconds,Last night my neighbors were over visiting..We were out back looking at the sky enjoying all the stars..There are no city lights where,5/12/2009,34.4258333,-112.5861111
4/17/2009 20:00,murrells inlet,sc,us,flash,60,less than minute,UFO was approximately 2000-5000 above the ocean&#44 hard to guage how far away they were.  First pulses of light brought object to our att,5/12/2009,33.5508333,-79.0416667
4/17/2009 21:20,lavalette,wv,us,circle,10,10 seconds,Bright&#44 moving circular object dims&#44 brightens slightly then disapears in a clear sky.,5/12/2009,38.3227778,-82.4469444
4/17/2009 21:30,lake villa,il,us,rectangle,2,seconds,It&#39s a first for me&#33,5/12/2009,42.4169444,-88.0738889
4/17/2009 21:30,yakima,wa,us,unknown,420,6-7 minutes,Two Completely Silent Illuminations Slow and Low,12/12/2009,46.6022222,-120.5047222
4/17/2009 22:35,nashville,nc,us,oval,8,7-8 seconds,Two craft sighted in the night sky over Nashville&#44 NC&#44 flying in a North Northeast direction.,5/12/2009,35.9744444,-77.9658333
4/17/2009 23:15,falls church,va,us,circle,8,8 seconds,At 11:15pm on April 17&#44 2009&#44 four bright objects were sighted flying at a very high speed&#44 in a strange pattern&#44 over N. Va,5/12/2009,38.8822222,-77.1713889
4/18/2009 0:03,rincon,ga,us,triangle,45,45 seconds,Small triangular shaped object making extremely sharp turns at a great speed.  ((NUFORC Note:  Student report.  PD)),5/12/2009,32.2958333,-81.2355556
4/18/2009 3:30,holland,mi,us,rectangle,15,15 seconds,3 objects moving very fast orange Color viewed for about 15 seconds,5/12/2009,42.7875,-86.1088889
4/18/2009 5:00,rodanthe,nc,us,unknown,4800,80 minutes,Starlike shape with beams of light that changed shape,5/12/2009,35.5933333,-75.4683333
4/18/2009 15:23,wichita,ks,us,triangle,120,1-2 minutes,triangle with green lights and black outer shell over wichita.,2/14/2010,37.6922222,-97.3372222
4/18/2009 17:00,oxnard,ca,us,other,120,2 mim,oxnard big brown craft passes jet airliner,5/12/2009,34.1975,-119.1761111
4/18/2009 19:30,el paso,tx,us,oval,3600,1 hour,unmoving object hanging in west texas sky.,5/12/2009,31.7586111,-106.4863889
4/18/2009 20:00,tucson,az,us,flash,600,10min,Ten minute stationary pulsating white light 80 degrees elevation 60 seconds between pulses 2000 MST.,5/12/2009,32.2216667,-110.9258333
4/18/2009 20:13,portland,or,us,chevron,30,30 seconds,Red and white floating object suddenly and extremely rapidly zips away.,5/12/2009,45.5236111,-122.675
4/18/2009 20:33,holiday,fl,us,unknown,90,90 seconds,We saw one set of red lights followed closely by a set of flashing white lights moving through the clouds.,5/12/2009,28.1875,-82.7397222
4/18/2009 21:00,hemet,ca,us,light,30,30 seconds,Light changes direction when military jet approaches.,6/9/2009,33.7475,-116.9711111
4/18/2009 21:00,seminole,fl,us,triangle,60,1 minute,2 triangles flying low in formation,5/12/2009,27.8394444,-82.7913889
4/18/2009 22:45,seminole,fl,us,,15,15 secs,Objects were flying south/south east. We saw them as we drove East along 102nd Ave in Seminole near to 125th St.     Two objects&#44 could,5/12/2009,27.8394444,-82.7913889
4/19/2009 0:00,east lansing,mi,us,oval,1800,30 min.,Four circular&#44 oval light shapes in midnight sky flying  and converging at a centerpoint.  ((NUFORC Note:  Advertising lights.  PD)),5/12/2009,42.7369444,-84.4838889
4/19/2009 4:00,dover,de,us,changing,3600,1 hour,Bright light changed shapes&#44 multiplied&#44 and faded out.  ((NUFORC Note:  Star??  PD)),5/12/2009,39.1580556,-75.5247222
4/19/2009 9:00,sulphur springs,tx,us,disk,3,0:03,I saw two silver crafts hoovering in the morning hours&#44 I&#39m not crazy&#33,5/12/2009,33.1383333,-95.6008333
4/19/2009 9:35,manhasset,ny,us,triangle,5,5 seconds,Shimmering triangle of dim white lights change direction quickly and are gone - with no jet noise.,5/12/2009,40.7977778,-73.7
4/19/2009 19:45,tucson,az,us,flash,600,10min,This is a follow-up from last nights report. We again observed a light flash of ten repetitions each about 60 seconds apart in the same,5/12/2009,32.2216667,-110.9258333
4/19/2009 20:30,methuen,ma,us,oval,90,1-1.5 minutes,Oval (flattened)&#44 orange and amber lights&#44 non flashing on sides and top&#44 going WSW&#44 followed by prop plane small (cesna)&#44 80 yds behin,5/12/2009,42.7261111,-71.1913889
4/19/2009 20:40,sun valley,ca,us,light,60,1 minute,super Fast Bright light in the sky of  Los Angeles,5/12/2009,34.2175,-118.3694444
4/19/2009 20:45,east derry,nh,us,triangle,900,10-15 minutes,multiple triangles with white lites in corners and one red flashing light in the middle&#44 moving fast and erractic,5/12/2009,42.8944444,-71.2916667
4/19/2009 20:55,salamanca,ny,us,fireball,180,3 minutes,Bright orange object flying silently through the sky,5/12/2009,42.1577778,-78.7152778
4/19/2009 21:35,ontario,ca,us,circle,120,2 minutes,4 orange dots im the sky,5/12/2009,34.0633333,-117.65
4/19/2009 22:10,oak harbor,wa,us,unknown,60,1 minute,Flash of light then object of four non-flashing dim lights traveling north.,5/12/2009,48.2933333,-122.6419444
4/19/2009 22:30,modesto,ca,us,light,900,15 minutes,Bright light in Modesto&#44 CA sky.  ((NUFORC Note:  Possible sighting of Sirius??  PD)),5/12/2009,37.6391667,-120.9958333
4/19/2009 22:45,campbell,ca,us,light,480,8 minutes,While looking off our balcony&#44 we saw a stationary bright light that after a few minutes dimmed and started moving at increasing speeds,5/12/2009,37.2872222,-121.9488889
4/20/2009 0:00,durham,nc,us,triangle,300,about 5 mins,Large triangular craft seen hovering over power lines,2/14/2010,35.9938889,-78.8988889
4/20/2009 1:02,burlington,vt,us,formation,5,5 seconds,Light formation streaks across Vermont sky,5/12/2009,44.4758333,-73.2125
4/20/2009 1:30,alpharetta,ga,us,rectangle,300,5 mins.,Large&#44 detailed craft sighting&#44 brightly lit as if parked in the sky&#44 very close&#44 and lights/all white were pulsating.,5/12/2010,34.0752778,-84.2941667
4/20/2009 4:55,graettinger,ia,us,other,300,5 minutes,Palo Alto County Iowa 5 minute durating,5/12/2009,43.2377778,-94.7511111
4/20/2009 6:00,grand prairie,tx,us,circle,2,seconds,Orb came out of no where seem to some straight at men and then veered up and went straight moving at a tremendous speed and disappeared,5/12/2009,32.7458333,-96.9975
4/20/2009 6:30,houston,tx,us,cigar,2,2 seconds,Glowing missile shaped object sited north of Houston IAH and heading towards earth.,5/12/2009,29.7630556,-95.3630556
4/20/2009 11:00,continental divide,nm,us,other,8,8 seconds,April 20 2009 Simi Circular craft Silver in color/with a teardrop shaped white underbelly seen near entrance to Chaco Canyon New Mexico,5/12/2009,35.425,-108.3147222
4/20/2009 14:00,fort collins,co,us,disk,1200,20 min,MOVED AT SPEEDS &#44 ANGLES THAT ARE NOT NORMAL,5/12/2009,40.5852778,-105.0838889
4/20/2009 15:00,waco,tx,us,egg,60,1 min,It was a gray egg shaped thing in the air by the airport.,12/12/2009,31.5491667,-97.1463889
4/20/2009 18:30,grand blanc,mi,us,light,1200,20 min,It was a flashing light going to fast to be a plane or sattilite.,8/7/2011,42.9275,-83.63
4/20/2009 18:35,las cruces,nm,us,fireball,600,10 minutes,Orange Fireball Traveling Northbound Over Las Cruces,5/12/2009,32.3122222,-106.7777778
4/20/2009 19:38,tucson,az,us,flash,900,15 min,This is a 3rd follow-up to the two previous nights reports. The same flash of light was seen south of the Leo constellation between the,5/12/2009,32.2216667,-110.9258333
4/20/2009 21:34,harrington,wa,us,light,45,45 sec.,Two adult males witness extremely bright&#44 moving&#44 light in the eastern sky; not Iridium satellite&#44 or ISS.,5/12/2009,47.4811111,-118.2533333
4/20/2009 23:30,moses lake,wa,us,other,720,12 minutes,small bright white light hovering near the airport and then left really fast clouse to the ground made no sounds,1/31/2011,47.1302778,-119.2769444
4/21/2009 2:05,colorado springs,co,us,triangle,2,a few seconds,Triangle craft with dim lights traveling low at a high rate of speed with no sound over the Colorado Springs airport.,5/12/2009,38.8338889,-104.8208333
4/21/2009 4:30,shawnee,ok,us,circle,20,roughly 20 seconds,This was the morning of april 21st&#44 the ufo was circular and emitted a beam of light from the underbelly.,6/9/2009,35.3272222,-96.925
4/21/2009 5:30,columbia,mo,us,light,3600,1 hour,Three &quot;stars&quot; / lights moving around the early morning sky.  ((NUFORC Note:  Possible sighting of star??  PD)),5/12/2009,38.9516667,-92.3338889
4/21/2009 9:05,new york city,ny,us,cylinder,300,5 mins,Ominous cylinders in the western sky.  ((NUFORC Note:  Possibly not a serious-minded report?  PD)),5/12/2009,40.7141667,-74.0063889
4/21/2009 11:20,dunedin,fl,us,triangle,120,2 minutes,I saw a strange black triangle with a silver circle in the middle&#44 it flew by my house&#44 maybe two of them.,6/9/2009,28.0194444,-82.7719444
4/21/2009 20:15,santa barbara,ca,us,sphere,300,5 minutes,Orange orbs over Santa Barbara,5/12/2009,34.4208333,-119.6972222
