datetime,city,state,country,shape,duration (seconds),duration (hours/min),comments,date posted,latitude,longitude 
9/10/2009 21:30,emmett,id,us,circle,60,60 sec,Light looked like a star but bigger and brighter went across the sky semi fast got dimmer. ((NUFORC Note:  Satellite??  PD)),12/12/2009,43.8736111,-116.4983333
9/10/2009 21:37,hayward,wi,us,sphere,180,3 min,Very bright light over northern Wisconsin.,12/12/2009,46.0130556,-91.4844444
9/11/2009 1:00,burbank,ca,us,formation,420,7min,first thought it was sky divers with lites till the lights formed and moved up 100 feet off  the ground that was when i freaked out.,12/12/2009,34.1808333,-118.3080556
9/11/2009 7:05,west chester,oh,us,light,20,20 sec.,Bright&#44 white light in the sky in West Chester&#44 OH 9/11/09 at 7:05am.,12/12/2009,39.0875,-81.9227778
9/11/2009 15:00,vancouver,wa,us,light,180,2-3 min,two orbes&#44 traveling SW to E&#44 not a plane&#44 sattelite&#44 nor shoot star&#44 disappeared into the sky.,12/12/2009,45.6388889,-122.6602778
9/11/2009 16:45,mesa,az,us,light,1800,30 min,Bright white light turns yellowish then fades away into space.,12/12/2009,33.4222222,-111.8219444
9/11/2009 18:45,chandler,az,us,light,900,15 minutes,dot light in sky north northeast of chandler&#44 az&#44 it did not move&#44 clouds passed it by,12/12/2009,33.3061111,-111.8405556
9/11/2009 19:00,mesa,az,us,unknown,1800,30 minutes,It was around 7:00 pm when I noticed a bright white sort of haze non moving light.It was at a very high alltitude because at first I th,12/12/2009,33.4222222,-111.8219444
9/11/2009 19:32,gresham,or,us,sphere,240,4 solid minutes,UFO seen over Gresham&#44 OR.  It was a black orb that  was tumbling through the air at a high rate of speed.,12/12/2009,45.4983333,-122.4302778
9/11/2009 20:00,paw paw,mi,us,circle,900,15 mins,3 circle objects appear over town,12/12/2009,42.2177778,-85.8911111
9/11/2009 20:30,lyman,sc,us,disk,15,15 seconds,((HOAX??))  I saw two blue saucer shaped craft in the sky just above the tree line moving up and down,12/12/2009,34.9480556,-82.1275
9/11/2009 20:45,horseshoe beach,fl,us,unknown,300,5 mins,for the last month almost every night strange lights appear off the coast of horseshoe beach where i live&#44 me and one of my friends are,12/12/2009,29.4411111,-83.2875
9/11/2009 21:00,enumclaw,wa,us,teardrop,60,about one minute,Driving along a back road in my town when another motorist and myself was it...,12/12/2009,47.2044444,-121.9902778
9/11/2009 21:00,escanaba,mi,us,light,60,60 sec.,Bright white light over Escanaba&#44 MI,12/12/2009,45.7452778,-87.0644444
9/11/2009 21:00,gig harbor,wa,us,sphere,3600,1+ hour,Multi-colored sphere hovering over Seattle,12/12/2009,47.3294444,-122.5788889
9/11/2009 21:15,lincoln,ne,us,circle,900,15 minutes,I left my apartment around 9:15 PM.  It was dark out.  I walked toward my car in the parking lot of the apartment complex.  To the east,3/27/2014,40.8,-96.6666667
9/11/2009 21:30,chicago,il,us,changing,2400,40 minutes,On Friday&#44 September 11&#44 at about 21:30 hours I observed&#44 in the sky south of my home in Prospect Heights&#44 Illinois&#44 two very bright ob,12/12/2009,41.85,-87.65
9/11/2009 21:30,salem,or,us,sphere,300,5 minutes,Four large orange spherical objects with a diamond shape &quot;halo&quot;in long arc overhead.,12/12/2009,44.9430556,-123.0338889
9/11/2009 22:00,fredericksburg,va,us,changing,1800,30 min,Strange colorful siting in the western sky,12/12/2009,38.3030556,-77.4608333
9/11/2009 22:00,spokane,wa,us,light,15,15 seconds,fast moving star like object over spokane&#44 washington 09/11/09,12/12/2009,47.6588889,-117.425
9/11/2009 23:00,leasburg,nc,us,triangle,900,15 mins,i need help with my case,11/21/2010,36.3944444,-79.1547222
9/11/2009 23:10,wesley chapel,fl,us,light,3,3sec,I was out front of my home smoking a cigarette and talking on my phone I was looking up facing east and saw a green glowing ball very b,12/12/2009,28.2394444,-82.3280556
9/12/2009 2:30,shorewood,wi,us,fireball,300,5 minutes,Flaming stationary object  over Shorewood Wisconsin,12/12/2009,43.0891667,-87.8875
9/12/2009 10:30,corona,ca,us,circle,720,12 minutes,Three orange circular objects in the evening sky hovered for 12 minutes and then vanished.,12/12/2009,33.8752778,-117.5655556
9/12/2009 11:00,miamisburg,oh,us,triangle,600,10 minutes,Miamisburg UFO Triangular White light hovering air craft spotted on Soldiers Home Miamisburg Rd.,12/12/2009,39.6427778,-84.2866667
9/12/2009 11:46,auburn,ca,us,triangle,30,30 seconds,Black craft 600 ft above home&#44 seen by two girls in suburban Auburn.,12/12/2009,38.8966667,-121.0758333
9/12/2009 12:45,chicago,il,us,teardrop,3600,1 hour,Tear shaped objects slowly moving across the lake about 100 feet from the surface of the water.,12/20/2012,41.85,-87.65
9/12/2009 13:35,edmonds,wa,us,chevron,10,10 seconds,Black Low Flying Boomerang Craft - Daytime - Both Wife and I shocked at what we witnessed at same time,12/12/2009,47.8108333,-122.3761111
9/12/2009 19:58,kelso,wa,us,cylinder,30,30 seconds,Very Big UFO over I-5 in Kelso,12/12/2009,46.1469444,-122.9072222
9/12/2009 20:00,mossyrock,wa,us,,5,5 seconds,Fast Traveling Craft with Fireball and Tail Streaks Accross Western Washington Sky,12/12/2009,46.5297222,-122.4838889
9/12/2009 20:10,port angeles,wa,us,light,6,5-6 seconds,Very bright white star like object moving at fast pace blast of blinding light and then vanished,12/12/2009,48.1183333,-123.4294444
9/12/2009 20:30,pleasantville,nj,us,other,540,9 min,8 ball shaped lights that changed colors and then faded in to the sky flying up.,12/12/2009,39.3897222,-74.5244444
9/12/2009 20:30,ridgecrest,ca,us,triangle,600,10 minutes,Triangular shaped object that flew over witnesses three times before splitting into 90 triangles and flying eastward,12/12/2009,35.6225,-117.67
9/12/2009 20:30,teachey,nc,us,unknown,120,2 mins,a light beamed down from the sky onto the ground,12/12/2009,34.7680556,-78.0083333
9/12/2009 20:33,florissant,mo,us,fireball,300,5 minutes,Hovering fireball object in the sky,12/12/2009,38.7891667,-90.3225
9/12/2009 21:00,brookfield,wi,us,circle,900,less than 15 minutes,Three amber colored lights moving at various distances.  No blinking aircraft lights or sound.,11/21/2010,43.0605556,-88.1063889
9/12/2009 21:05,brookfield,wi,us,triangle,600,5-10 minutes,Two groups of  yellow -orange lights formed a moving&#44 silent triangle that rose into the night sky faded and disappeared,12/12/2009,43.0605556,-88.1063889
9/12/2009 22:00,dorr,mi,us,circle,600,10 minutes,We seen A orange-red glowing object saturday 9-12-09 about 10:00 pm.It started out low and headed west then it just kept rising And dis,12/12/2009,42.7252778,-85.7225
9/12/2009 22:00,inver grove heights,mn,us,fireball,600,5-10 minutes,fireballsin sky,12/12/2009,44.8480556,-93.0425
9/12/2009 22:00,parma,oh,us,fireball,900,15 minutes,Multiple fast moving fire lights at different intervals on same vector disappearing at same spot.,12/12/2009,41.4047222,-81.7230556
9/12/2009 22:53,encino,ca,us,triangle,120,2 minutes each,Blue and red triangular craft spotted; red disc spotted soon after,12/12/2009,34.1591667,-118.5002778
9/13/2009 0:00,everett,wa,us,light,604800,1 week,flashing lights during night and silver eliptacal during day,12/12/2009,47.9791667,-122.2008333
9/13/2009 0:30,marietta,oh,us,circle,60,1 minutes,Circular space craft with large light in center and small surrounding circular lights seen hoovering near I-77,12/12/2009,39.4152778,-81.455
9/13/2009 4:00,walla walla,wa,us,unknown,4800,1 hour and 20 min,UFO over Walla Walla WA.,12/12/2009,46.0647222,-118.3419444
9/13/2009 5:00,charlotte,nc,us,chevron,5,5 seconds,Faint chevron-shaped object over Charlotte&#44 NC,12/12/2009,35.2269444,-80.8433333
9/13/2009 19:00,manitowoc,wi,us,light,300,5 minutes,Three Bright Lights over Manitowoc,12/12/2009,44.0886111,-87.6575
9/13/2009 19:30,saline,mi,us,light,10,10 seconds,It started on 9-13-09 i was driving home from work at 7:30 heading south when an orenge light of to the east caught my eye i watched it,12/12/2009,42.1666667,-83.7816667
9/13/2009 20:00,modesto,ca,us,formation,120,2 min,3 brightly lit formation in the sky in Central California,12/12/2009,37.6391667,-120.9958333
9/13/2009 20:15,lyons,or,us,light,30,30 seconds,bright light moving slowly across the sky &amp; suddenly disapears,12/12/2009,44.7747222,-122.6138889
9/13/2009 20:15,ypsilanti,mi,us,changing,30,several hours,Very bright object hovered aboved the treetops for a long time before moving extremely slowly toward the west.  ((Star??)),12/12/2009,42.2411111,-83.6130556
9/13/2009 20:17,kent,wa,us,light,1,1 second,Looking exactly like Jupiter in night sky&#44 a light appeared high in sky at time of ISS orbiting above&#44 speeds across&#44 vanishes&#44 it exhi,3/13/2012,47.3811111,-122.2336111
9/13/2009 21:00,winthrop,wa,us,circle,2700,45 min,Multi-colored flashing UFO and White bright UFO.,12/12/2009,48.4780556,-120.185
9/13/2009 22:30,chicago,il,us,triangle,90,90 seconds,3 red/orange lights in an isosceles triangle formation.,12/12/2009,41.85,-87.65
9/14/2009 0:30,fontana,ca,us,circle,60,1 minute,5 white circles were seen from the east going from south to north.,12/12/2009,34.0922222,-117.4341667
9/14/2009 1:45,salt lake city,ut,us,light,1800,15 &amp; 30 mins,star-like object changed color from white light to red; moved very fast &amp; maneuvred like no conventional aircraft,12/12/2009,40.7608333,-111.8902778
9/14/2009 4:30,ann arbor,mi,us,unknown,1800,one hour +,Craft flashing many colors near Ann Arbor&#44 MI,12/12/2009,42.2708333,-83.7263889
9/14/2009 8:32,somersworth,nh,us,fireball,120,1 to 2 mins,Ball of flame that appeared to prepare to land&#33,12/12/2009,43.2616667,-70.8658333
9/14/2009 12:00,meadville,pa,us,,180,3 mins,((HOAX??))  SPIDER ALEIN&#44 20 legs waist high showed itself to me.  ((NUFORC Note:  Student report.  PD)),8/24/2010,41.6413889,-80.1516667
9/14/2009 13:10,phoenix,az,us,formation,900,15min,6 craft over phoenix in broad day light visible for at least 15 minutes,12/12/2009,33.4483333,-112.0733333
9/14/2009 19:40,warrior,al,us,sphere,15,15 seconds,bright lime green sphere explodes and falls in Blount co. Alabama,12/12/2009,33.8141667,-86.8094444
9/14/2009 20:27,vallejo,ca,us,diamond,5,5 seconds,Observed a kite-shaped asterism silently moving like a low flying plane.,12/12/2009,38.1041667,-122.2555556
9/14/2009 21:00,burlington,ma,us,unknown,5400,90 minutes,Multicolored object moving vertically and horizontally without sound. ((NUFORC Note:  Possible twinkling star??  PD)),12/12/2009,42.5047222,-71.1961111
9/14/2009 22:15,chesapeake,va,us,unknown,120,2 mins,Around 10:15 pm on September 14&#44 2009.  My fiance and I witnessed a light traveling at a fast speed.  At first glance we thought it was,12/12/2009,36.8188889,-76.2752778
9/14/2009 22:30,auburn,wa,us,unknown,1,:01,Orange light seen over South King Co Wa&#44,12/12/2009,47.3075,-122.2272222
9/14/2009 22:30,isle of palms,sc,us,light,1200,15-20 mins,7 lights sighted off of Isle of Palms&#44 SC&#44 9/14/09,12/12/2009,32.7866667,-79.795
9/14/2009 23:00,glendale,ca,us,other,180,3 minutes,A V-shaped object in the night sky&#44 no noise&#44 could only be seen with binoculars,11/21/2010,34.1425,-118.2541667
9/14/2009 23:00,port byron,ny,us,cigar,5,5 seconds,Cigar-shaped object sighted in NY,12/12/2009,43.0344444,-76.6241667
9/15/2009 4:12,houston,tx,us,oval,120,1 to 2 minutes,Oval shaped object&#44 huge and very&#44 very bright approx. 100 yards in front of my car.,12/12/2009,29.7630556,-95.3630556
9/15/2009 7:12,lake havasu city,az,us,light,12,12 seconds,Two bright verticle blue neon lights appeared the in sky flashed&#44 then disappeared.,12/12/2009,34.4838889,-114.3216667
9/15/2009 8:30,el  dorado hills,ca,us,unknown,585,9:45,looks like a blinking star with white&#44 red&#44 blue lights &#44 appears and disappears.  ((NUFORC Note:  Possible sighting of Sirius?  PD)),12/12/2009,38.6858333,-121.0811111
9/15/2009 20:00,pensacola,fl,us,sphere,60,1 minute,Large Red Glowing Ball Diagonal descent from sky,12/12/2009,30.4211111,-87.2169444
9/15/2009 20:00,seaside,or,us,light,5400,1.5 hrs.,Slow moving&#44 multi-colored and unexplainable by me&#44 a longtime resident. ((NUFORC Note:  Possible star?  PD)),12/12/2009,45.9933333,-123.9213889
9/15/2009 20:30,troy,pa,us,light,180,2 to 3 minutes,Orange light traveling westerly then turning south and up increasing speed over Troy Pa.,12/12/2009,41.7858333,-76.7883333
9/15/2009 20:43,mount pleasant,sc,us,formation,30,30 sec,Half Arrow shaped string of white&#44 christmas like&#44 and barely flashing/flaring lights.  About 6 n the main line and 3 on the half arrow,12/12/2009,32.7938889,-79.8627778
9/15/2009 21:00,pass christian,ms,us,sphere,3600,approx. 1 hour,Stationary orange lights appear then fade away after a few seconds off MS Gulf Coast.,12/12/2009,30.3155556,-89.2475
9/15/2009 21:30,ocean isle beach,nc,us,light,900,15 minutes,Strange lights over Ocean Isle Beach&#44 NC.,12/12/2009,33.8941667,-78.4269444
9/15/2009 21:30,phenix city,al,us,unknown,2,2 seconds,Extremely fast light in low sky.,12/12/2009,32.4708333,-85.0008333
9/15/2009 21:37,post falls,id,us,light,300,5 minuates,Unkn object following aircraft,12/12/2009,47.7180556,-116.9505556
9/15/2009 22:00,palm bay,fl,us,light,300,5 minutes,Two green lights were witnessed by myself and my coworker in Palm Bay&#44 Florida on September 15&#44 2009.,12/12/2009,28.0341667,-80.5888889
9/15/2009 22:00,sunset beach,nc,us,light,1200,20 minutes,Mysterious Lights witnessed over Sunset Beach&#44 NC,12/12/2009,33.8805556,-78.5125
9/15/2009 22:30,renton,wa,us,sphere,45,45 seconds,Two brown spherical objects rotating around each other,12/12/2009,47.4830556,-122.2158333
9/15/2009 23:00,loleta,ca,us,light,1200,20 minutes,Bright white light flickering red and green over the pacific ocean.  ((NUFORC Note:  Possible sighting of twinkling star?  PD)),12/12/2009,40.6411111,-124.2241667
9/16/2009 0:02,conroe,tx,us,chevron,5,5 seconds,Chevron object&#44 no noise&#44 no lights.,12/12/2009,30.3116667,-95.4558333
9/16/2009 0:10,los angeles,ca,us,disk,240,4 minutes,Curcular disk shaped craft with 3 bright lights ascends straight up into the sky over Los Angeles at an unusually slow speed.,12/12/2009,34.0522222,-118.2427778
9/16/2009 13:20,aurora,co,us,oval,15,15 seconds,Brillant oblong object spotted over Aurora&#44 CO.,12/12/2009,39.7294444,-104.8313889
9/16/2009 17:00,ajo,az,us,light,1800,15-30 mins,Many lights&#44 changing color and blinking randomly&#44 merging and dividing&#44 flying randomly and also in formation&#44 in Ajo&#44 AZ on 9/16/09.,12/12/2009,32.3716667,-112.86
9/16/2009 17:15,columbus,oh,us,unknown,300,5 minutes,Silver looking object disappears into the sky.,12/12/2009,39.9611111,-82.9988889
9/16/2009 20:30,asotin,wa,us,flash,30,30 seconds,Flash in the sky moving south&#44 south of asotin washington,12/12/2009,46.3394444,-117.0472222
9/16/2009 21:00,kearney,mo,us,fireball,3900,5 min to 1 hour,hazy blue huge falling star&#44 no sound&#44 followed by small light disapearing moving S>N and spyplane next.,12/12/2009,39.3677778,-94.3619444
9/16/2009 21:54,dothan,al,us,diamond,240,4 minutes,Diamond shaped silent object floating over Dothan&#44 AL,12/12/2009,31.2230556,-85.3905556
9/16/2009 22:00,kenova,wv,us,circle,60,1 minute,I saw a large&#44 bright circular light&#44 followed by a lot of &quot;sparks&quot;.,12/12/2009,38.3988889,-82.5783333
9/17/2009 0:00,brownsdale,mn,us,changing,14400,4 hrs,((HOAX??))  Hurry up and check this out wierd things fill the sky and really scary things have been happening&#33&#33&#33,12/12/2009,43.7402778,-92.8691667
9/17/2009 0:00,houston,tx,us,circle,120,2 minutes,Glowing green orb.,5/29/2011,29.7630556,-95.3630556
9/17/2009 1:00,fairborn,oh,us,unknown,600,10 mins,Pulsing glow of light dancing over WPAFB,5/12/2010,39.8208333,-84.0194444
9/17/2009 9:50,everett,wa,us,triangle,10,10 seconds,I saw a triangle ufo with four white lights moving quickly with no sound in Everett Wa.,12/12/2009,47.9791667,-122.2008333
9/17/2009 11:50,auburn,ca,us,triangle,300,5 min,A large&#44 black triangle ship flying low at mid-day with no sound,2/14/2010,38.8966667,-121.0758333
9/17/2009 20:19,clinton,ct,us,unknown,20,20 seconds,It was a gold color but up very high like in space. No strobes&#44 red&#44 green lights.,12/12/2009,41.2786111,-72.5280556
9/17/2009 21:10,williamsville,ny,us,triangle,15,15 seconds,Orange-yellowish&#44 hazy lights in the shape of a triangle.,12/12/2009,42.9638889,-78.7380556
9/17/2009 22:00,new haven,mo,us,unknown,900,15 min,unknown object with many colored lights floating in sky for several minutes.,12/12/2009,38.6083333,-91.2188889
9/17/2009 23:00,cincinnati,oh,us,circle,900,15nin,.I was lying down for the night and looked up to see a very large orange orbe in the window that would minamize then expand to become l,12/12/2009,39.1619444,-84.4569444
9/18/2009 4:15,huntington beach,ca,us,light,60,1 minute +,Two bright blue lights in western sky southern california,12/12/2009,33.6602778,-117.9983333
9/18/2009 19:31,new rochelle,ny,us,diamond,45,45 seconds,Slow moving star light,12/12/2009,40.9113889,-73.7827778
9/18/2009 20:00,hackettstown,nj,us,light,30,30 sec,A pinpoint star-like light appeared and illuminated a foggy area beneath it&#44 much like a flash-light&#44 then diminished&#44.,12/12/2009,40.8538889,-74.8294444
9/18/2009 20:00,martinsburg,wv,us,sphere,45,45 seconds,stationary object opened from the bottom a spotlight type beam that slowly brightened /expanded then faded away slowly then up in sky,12/12/2009,39.4561111,-77.9641667
9/18/2009 20:05,portsmouth,nh,us,light,20,appx 15-20 sec,single point of white light with a long funnel shaped trailing white light lasted for appx 15 - 20 seconds then faded out it was appx.2,12/12/2009,43.0716667,-70.7630556
9/18/2009 20:15,corry,pa,us,light,60,1 min,Bright light and beam vanishes into thin air,12/12/2009,41.9202778,-79.6405556
9/18/2009 20:30,freehold,nj,us,light,20,20 seconds,Strange light over Freehold&#44 NJ,12/12/2009,40.26,-74.2741667
9/18/2009 20:50,preston,mo,us,triangle,300,3 to 5 minutes,Ufo in Preston&#44 Mo,12/12/2009,37.9408333,-93.2075
9/18/2009 21:00,boise,id,us,light,1200,20 mins,A red light North of Boise&#44 erratic/still&#44 movment&#33,12/12/2009,43.6136111,-116.2025
9/18/2009 21:00,natrona heights,pa,us,fireball,120,few minutes,Unidentified flame flying low over natrona heights,12/12/2009,40.6233333,-79.73
9/18/2009 21:10,boise,id,us,circle,1800,30 minutes,Circle of intensely bright red lights that initially spewed out falling lights and hovered for a long time before receding slowing up.,12/12/2009,43.6136111,-116.2025
9/18/2009 21:15,redding,ca,us,disk,8,8 seconds,Soft orange glowing diamond shape with circular center,12/12/2009,40.5866667,-122.3905556
9/18/2009 21:30,charlevoix,mi,us,circle,300,5 minutes,4 Orange Lights Observed In The Sky,12/12/2009,45.3180556,-85.2583333
9/18/2009 21:50,boise,id,us,light,900,15:00,Bright red light in sky moving very slow and at a random pace.,12/12/2009,43.6136111,-116.2025
9/18/2009 21:52,rockville,ct,us,oval,120,2 minutes,Fast moving&#44 oval shaped ufo with orange light that went back and forth on the bottom.,12/12/2009,41.8666667,-72.45
9/18/2009 22:30,st. louis,mo,us,formation,120,2 min,6 glowing orange lights with a center blue light seen in St. Louis,12/12/2009,38.6272222,-90.1977778
9/18/2009 23:00,boise,id,us,light,1200,20 minutes,Red&#44 slowly pulsating light&#44 that hovered in the north for twenty minutes.,12/12/2009,43.6136111,-116.2025
9/19/2009 3:00,philadelphia,pa,us,fireball,8,8 seconds,What did I see&#44 a shooting star or is it something that moves faster then a plane&#33,12/12/2009,39.9522222,-75.1641667
9/19/2009 5:45,peculiar,mo,us,oval,5,5 seconds,Oval shaped object moving at extremely high rate with low light on opposite edges.,12/12/2009,38.7191667,-94.4583333
9/19/2009 9:00,gurnee,il,us,fireball,120,2 minutes,Two spherical bright orange objects flew slowly across the sky&#44 slowed down and kept going in a straight line and then disappeared.,12/12/2009,42.3702778,-87.9019444
9/19/2009 12:35,waterville,me,us,sphere,10,10 seconds,we both could not believer what we saw,12/12/2009,44.5519444,-69.6322222
9/19/2009 17:15,bernalillo,nm,us,teardrop,8100,2 hrs. 15 min.,Pearlescent&#44 teardrop object stationary in sky for two hours&#44 turns red and disappears at night fall,12/12/2009,35.3,-106.5505556
9/19/2009 19:00,renton,wa,us,triangle,180,3 minutes,Triangular object with three red steady lights flying over Renton.,2/14/2010,47.4830556,-122.2158333
9/19/2009 19:05,lovell,me,us,triangle,300,3-5 min,triangle shapes hovering over Kezar Lake at sunset.,12/12/2009,44.1266667,-70.8922222
9/19/2009 19:15,bethesda,oh,us,oval,300,5 minutes,white oval light with wide light beam  ((NUFORC Note:  Missile launch.  PD)),12/12/2009,40.0161111,-81.0727778
9/19/2009 19:30,amagansett,ny,us,light,10,10 seconds,7:30 ish&#44 Bright light with a bell shaped cloud over the atlantic off the cost of Amagansett. ((NUFORC Note:  Missile launch.  PD)),12/12/2009,40.9736111,-72.1441667
9/19/2009 19:30,joppa,md,us,unknown,120,2 minutes,Bright searchlight hovered at high altitude and then rapidly ascended from view.((NUFORC Note:  Missile launch.  PD)),12/12/2009,39.4336111,-76.3580556
9/19/2009 19:45,hanover,pa,us,light,60,< 1 minute,Bright white light in cloudless sky approximately 20&#44000 ft.  ((NUFORC Note:  Missile launch.  PD)),12/12/2009,39.8005556,-76.9833333
9/19/2009 19:45,lisbon,me,us,circle,10,10 seconds,Bright blue beam hovering&#44 slowly descending to the ground. No sound at all&#44 6 witnesses,12/12/2009,44.0313889,-70.105
9/19/2009 19:45,sanford,me,us,light,120,1-2 minutes,We were having a fire and saw a very bright cone shaped light above the tree line&#44 it stayed for a minute or so then vanished.,12/12/2009,43.4391667,-70.7747222
9/19/2009 19:45,somerset,nj,us,light,30,15-30 seconds,Extremely bright cones shaped light shining down from the sky.  ((NUFORC Note:  Missile launch.  PD)),12/12/2009,40.4975,-74.4888889
9/19/2009 19:45,suffolk,va,us,light,30,30 seconds,Bright light in sky.  ((NUFORC Note:  Missile launch.  PD)),12/12/2009,36.7280556,-76.5838889
9/19/2009 19:45,towson,md,us,triangle,30,30 seconds,A small sphere shape object appeared&#44 with a triangle shaped light being emitted from the bottom. ((NUFORC Note:  Missile launch.  PD)),12/12/2009,39.4013889,-76.6022222
9/19/2009 19:46,putney,vt,us,light,60,60 seconds,VANISHING BRIGHT WHITE LIGHT WITH CONE SHAPED MIST IN PUTNEY&#44 VT.  ((NUFORC Note:  Missile launch.  PD)),12/12/2009,42.9747222,-72.5222222
9/19/2009 19:50,abingdon,md,us,cylinder,180,3 minutes,Extremely bright and radiating light outward.  ((NUFORC Note:  Missile launch.  PD)),12/12/2009,39.4622222,-76.2794444
9/19/2009 19:50,auburn,ma,us,disk,20,20 seconds,a white cone shape light  in the sky.  ((NUFORC Note:  Missile launch.  PD)),12/12/2009,42.1944444,-71.8361111
9/19/2009 19:50,bellingham,ma,us,flash,60,1 minute,Strange light progressivly brighter&#44 cone of light from below in Massachusetts&#44 ((NUFORC Note:  Missile launch.  PD)),12/12/2009,42.0866667,-71.475
9/19/2009 19:50,berwick,me,us,triangle,20,20 seconds,(light with defined beam appeared very bright(looked like an upside down v). ((NUFORC Note:  Missile launch.  PD)),12/12/2009,43.2658333,-70.865
9/19/2009 19:50,burlington,nj,us,cone,30,30 seconds,7:50 PM&#44 cone-shaped object&#44 three spot-light type lights.  ((NUFORC Note:  Missile launch.  PD)),12/12/2009,40.0711111,-74.8652778
9/19/2009 19:50,dundalk,md,us,sphere,45,45 seconds,A dark sphere appeared southeast of dundalk&#44 maryland then disappeared leaving a haze of smoke.((NUFORC Note:  Missile launch.  PD)),12/12/2009,39.2505556,-76.5208333
9/19/2009 19:50,evans city,pa,us,triangle,15,15 seconds,Triangular object in the sky in Evans City pa  ((NUFORC Note:  Missile launch.  PD)),12/12/2009,40.7691667,-80.0630556
9/19/2009 19:50,harrisonburg,va,us,disk,90,1 minute 30 sec,Very bright disk shape eastern sky Harrisonburg. ((NUFORC Note:  Missile launch.  PD)),12/12/2009,38.4494444,-78.8691667
9/19/2009 19:50,leesburg,va,us,cone,20,20 seconds,Object with cone shaped tail rises above Dulles&#44 VA.  ((NUFORC Note:  Missile launch.  PD)),12/12/2009,39.1155556,-77.5638889
9/19/2009 19:50,manalapan,nj,us,circle,15,15 sec,circular stationary white light shining straight down thru an apparent haze.  ((NUFORC Note:  Missile launch.  PD)),12/12/2009,40.2572222,-74.3961111
9/19/2009 19:50,pittstown,nj,us,light,15,15 seconds,two beams of light high in the sky.  ((NUFORC Note:  Missile launch.  PD)),12/12/2009,40.5819444,-74.9594444
9/19/2009 19:50,providence,ri,us,unknown,20,20 seconds,I ran across information that seems to explain the beams.  ((NUFORC Note:  Missile launch.  PD)),12/12/2009,41.8238889,-71.4133333
9/19/2009 19:50,riverhead,ny,us,cone,60,less than 1 minute,It was like a bright white spot light.  It then split into 2 and disapeared. ((NUFORC Note:  Missile launch.  PD)),12/12/2009,40.9169444,-72.6625
9/19/2009 19:50,sterling,ct,us,unknown,180,3 min,Large glow of light that led down to a beam with no sound.  ((NUFORC Note:  Missile launch.  PD)),12/12/2009,41.7075,-71.8291667
9/19/2009 19:50,troy,ny,us,unknown,2,seconds,large bright missle like object&#44 headed straight up leaving an inverted v shaped dust cloud behind it - very very large - reached a cer,12/12/2009,42.7283333,-73.6922222
9/19/2009 19:50,trumbull,ct,us,sphere,60,1 minute,Bright white light over Trumbull&#44 CT.  ((NUFORC Note:  Missile launch.  PD)),12/12/2009,41.2427778,-73.2011111
9/19/2009 19:50,west grove,pa,us,light,120,2 minutes,West Grove PA 9/19/09 Chester County 19:50  ((NUFORC Note:  Missile launch.  PD)),12/12/2009,40.0047222,-75.635
